[
  {
    "id": "seoul-1392",
    "title": "조선 건국",
    "year": 1392,
    "place": "한양(서울)",
    "country": "한국",
    "region": "동아시아",
    "lat": 37.5665,
    "lon": 126.978,
    "category": "politics",
    "summary": "이성계가 새 왕조 조선을 세웠고 한양은 곧 수도로 정비되었다.",
    "significance": "한양의 수도화는 이후 500년 넘게 한반도의 정치·행정 중심 구조를 형성했다.",
    "people": [
      "이성계",
      "정도전"
    ],
    "relatedPlaces": [
      "경복궁",
      "종묘",
      "한양도성"
    ],
    "keyPoints": [
      "고려에서 조선으로 왕조가 교체됨",
      "유교적 국가 체제가 강화됨",
      "한양이 새 수도로 건설됨"
    ],
    "wikiQuery": "조선 건국",
    "wikiQueryEn": "조선 건국"
  },
  {
    "id": "seoul-1446",
    "title": "훈민정음 반포",
    "year": 1446,
    "place": "한양(서울)",
    "country": "한국",
    "region": "동아시아",
    "lat": 37.58,
    "lon": 126.99,
    "category": "culture",
    "summary": "세종이 창제한 훈민정음이 해례와 함께 반포되었다.",
    "significance": "문자 생활의 진입 장벽을 크게 낮추었고 오늘날 한글의 기원이 되었다.",
    "people": [
      "세종",
      "정인지"
    ],
    "relatedPlaces": [
      "경복궁",
      "집현전"
    ],
    "keyPoints": [
      "소리의 원리를 반영한 문자 설계",
      "백성이 쉽게 익히도록 하는 목적",
      "해례본은 창제 원리를 설명함"
    ],
    "wikiQuery": "훈민정음",
    "wikiQueryEn": "훈민정음"
  },
  {
    "id": "busan-1592",
    "title": "부산진 전투",
    "year": 1592,
    "place": "부산",
    "country": "한국",
    "region": "동아시아",
    "lat": 35.1796,
    "lon": 129.0756,
    "category": "war",
    "summary": "일본군의 조선 침공 초기에 부산진에서 전투가 벌어졌다.",
    "significance": "임진왜란의 육상 침공이 본격화되는 첫 관문이었다.",
    "people": [
      "정발",
      "고니시 유키나가"
    ],
    "relatedPlaces": [
      "부산진성",
      "동래성"
    ],
    "keyPoints": [
      "일본군이 부산을 교두보로 삼음",
      "조선 방어 체계의 취약점이 드러남",
      "전쟁이 전국으로 급속히 확대됨"
    ],
    "wikiQuery": "부산진 전투",
    "wikiQueryEn": "부산진 전투"
  },
  {
    "id": "hansan-1592",
    "title": "한산도 대첩",
    "year": 1592,
    "place": "통영 한산도",
    "country": "한국",
    "region": "동아시아",
    "lat": 34.835,
    "lon": 128.42,
    "category": "war",
    "summary": "이순신이 지휘한 조선 수군이 한산도 앞바다에서 일본 수군을 크게 격파했다.",
    "significance": "일본군의 해상 보급망에 타격을 주어 전쟁의 전략적 균형에 영향을 주었다.",
    "people": [
      "이순신",
      "이억기",
      "와키자카 야스하루"
    ],
    "relatedPlaces": [
      "한산도",
      "통영",
      "여수"
    ],
    "keyPoints": [
      "학익진 전술로 알려진 해전",
      "조선 수군의 제해권 확보에 기여",
      "육상군 보급 계획에 큰 제약을 줌"
    ],
    "wikiQuery": "한산도 대첩",
    "wikiQueryEn": "한산도 대첩"
  },
  {
    "id": "jinju-1592",
    "title": "진주대첩",
    "year": 1592,
    "place": "진주",
    "country": "한국",
    "region": "동아시아",
    "lat": 35.18,
    "lon": 128.108,
    "category": "war",
    "summary": "김시민이 지휘한 조선군이 진주성을 방어하며 일본군의 공세를 막았다.",
    "significance": "호남으로 진출하려는 일본군의 계획을 저지한 대표적 방어전으로 기억된다.",
    "people": [
      "김시민"
    ],
    "relatedPlaces": [
      "진주성",
      "남강"
    ],
    "keyPoints": [
      "성곽 방어전의 대표 사례",
      "민관이 함께 방어에 참여",
      "임진왜란 3대 대첩 중 하나로 전해짐"
    ],
    "wikiQuery": "진주대첩",
    "wikiQueryEn": "진주대첩"
  },
  {
    "id": "seoul-1897",
    "title": "대한제국 선포",
    "year": 1897,
    "place": "서울",
    "country": "한국",
    "region": "동아시아",
    "lat": 37.57,
    "lon": 126.976,
    "category": "politics",
    "summary": "고종이 국호를 대한제국으로 바꾸고 황제에 즉위했다.",
    "significance": "국제 질서 속에서 자주독립국임을 강조하려는 근대 국가 전략의 표현이었다.",
    "people": [
      "고종"
    ],
    "relatedPlaces": [
      "환구단",
      "덕수궁"
    ],
    "keyPoints": [
      "황제국 체제 선언",
      "광무개혁 추진",
      "열강 경쟁 속 자주권 강조"
    ],
    "wikiQuery": "대한제국",
    "wikiQueryEn": "대한제국"
  },
  {
    "id": "seoul-1919",
    "title": "3·1 운동",
    "year": 1919,
    "place": "서울",
    "country": "한국",
    "region": "동아시아",
    "lat": 37.57,
    "lon": 126.983,
    "category": "politics",
    "summary": "독립선언서 발표를 계기로 전국적인 만세운동이 확산되었다.",
    "significance": "비폭력 대중 독립운동이 임시정부 수립과 국제적 독립운동 전개에 큰 영향을 주었다.",
    "people": [
      "유관순",
      "손병희"
    ],
    "relatedPlaces": [
      "탑골공원",
      "서대문형무소"
    ],
    "keyPoints": [
      "전국적 대중 참여",
      "대한민국 임시정부 수립의 계기",
      "독립운동 방식이 다양해짐"
    ],
    "wikiQuery": "3·1 운동",
    "wikiQueryEn": "3·1 운동"
  },
  {
    "id": "seoul-1988",
    "title": "서울 올림픽",
    "year": 1988,
    "place": "서울",
    "country": "한국",
    "region": "동아시아",
    "lat": 37.515,
    "lon": 127.073,
    "category": "culture",
    "summary": "서울에서 제24회 하계 올림픽이 열렸다.",
    "significance": "냉전 말기 동서 진영이 폭넓게 참가한 국제행사로 한국의 대외 인지도를 크게 높였다.",
    "people": [
      "손기정"
    ],
    "relatedPlaces": [
      "잠실종합운동장",
      "올림픽공원"
    ],
    "keyPoints": [
      "160개국 이상 참가",
      "도시 인프라 대규모 확충",
      "한국의 국제적 이미지 변화"
    ],
    "wikiQuery": "1988 서울 올림픽",
    "wikiQueryEn": "1988 서울 올림픽"
  },
  {
    "id": "xian-629",
    "title": "현장의 서역행 출발",
    "year": 629,
    "place": "장안(시안)",
    "country": "중국",
    "region": "동아시아",
    "lat": 34.3416,
    "lon": 108.9398,
    "category": "exploration",
    "summary": "승려 현장이 불교 경전을 구하기 위해 장안을 떠나 중앙아시아와 인도를 향했다.",
    "significance": "그의 여행 기록은 7세기 아시아의 지리·종교·교류를 이해하는 중요한 자료가 되었다.",
    "people": [
      "현장"
    ],
    "relatedPlaces": [
      "둔황",
      "사마르칸트",
      "날란다"
    ],
    "keyPoints": [
      "당대 국제 교류망 활용",
      "불교 경전과 지식의 이동",
      "대당서역기로 여행 정보가 전해짐"
    ],
    "wikiQuery": "현장 삼장",
    "wikiQueryEn": "현장 삼장"
  },
  {
    "id": "beijing-1420",
    "title": "자금성 완공",
    "year": 1420,
    "place": "베이징",
    "country": "중국",
    "region": "동아시아",
    "lat": 39.9163,
    "lon": 116.3972,
    "category": "architecture",
    "summary": "명 영락제 시기에 자금성이 완성되고 베이징이 제국 수도로 자리잡았다.",
    "significance": "궁궐 공간 자체가 황제 중심의 정치 질서와 의례 체계를 시각적으로 보여준다.",
    "people": [
      "영락제"
    ],
    "relatedPlaces": [
      "자금성",
      "천단"
    ],
    "keyPoints": [
      "명·청 황궁으로 사용",
      "중축선 중심의 계획",
      "정치와 의례 공간이 분리됨"
    ],
    "wikiQuery": "자금성",
    "wikiQueryEn": "자금성"
  },
  {
    "id": "nanjing-1368",
    "title": "명 왕조 건국",
    "year": 1368,
    "place": "난징",
    "country": "중국",
    "region": "동아시아",
    "lat": 32.0603,
    "lon": 118.7969,
    "category": "politics",
    "summary": "주원장이 명을 세우고 난징을 수도로 삼았다.",
    "significance": "몽골계 원 왕조 이후 한족 왕조가 재건되며 동아시아 질서가 재편되었다.",
    "people": [
      "홍무제"
    ],
    "relatedPlaces": [
      "명효릉",
      "난징성벽"
    ],
    "keyPoints": [
      "원 말 혼란 이후 통일",
      "중앙집권 강화",
      "후대 베이징 천도의 기반 마련"
    ],
    "wikiQuery": "명나라",
    "wikiQueryEn": "명나라"
  },
  {
    "id": "beijing-1644",
    "title": "명 멸망과 청의 베이징 입성",
    "year": 1644,
    "place": "베이징",
    "country": "중국",
    "region": "동아시아",
    "lat": 39.9042,
    "lon": 116.4074,
    "category": "politics",
    "summary": "이자성의 반란으로 명이 붕괴한 뒤 청군이 산해관을 넘어 베이징에 들어왔다.",
    "significance": "중국 본토에서 청 왕조 지배가 본격화되는 전환점이었다.",
    "people": [
      "숭정제",
      "이자성",
      "도르곤"
    ],
    "relatedPlaces": [
      "자금성",
      "산해관"
    ],
    "keyPoints": [
      "명 왕조의 종말",
      "청의 중국 지배 시작",
      "17세기 동아시아 질서 변화"
    ],
    "wikiQuery": "명청교체",
    "wikiQueryEn": "명청교체"
  },
  {
    "id": "wuhan-1911",
    "title": "신해혁명과 우창봉기",
    "year": 1911,
    "place": "우한",
    "country": "중국",
    "region": "동아시아",
    "lat": 30.5928,
    "lon": 114.3055,
    "category": "politics",
    "summary": "우창봉기를 시작으로 청 왕조에 반대하는 혁명이 전국으로 확산됐다.",
    "significance": "중국의 제정 체제가 무너지고 공화정이 수립되는 계기가 되었다.",
    "people": [
      "쑨원",
      "위안스카이"
    ],
    "relatedPlaces": [
      "우창",
      "난징"
    ],
    "keyPoints": [
      "청 왕조 붕괴",
      "중화민국 수립",
      "근대 중국 정치의 출발점"
    ],
    "wikiQuery": "신해혁명",
    "wikiQueryEn": "신해혁명"
  },
  {
    "id": "kyoto-794",
    "title": "헤이안쿄 천도",
    "year": 794,
    "place": "교토",
    "country": "일본",
    "region": "동아시아",
    "lat": 35.0116,
    "lon": 135.7681,
    "category": "politics",
    "summary": "일본 조정이 수도를 헤이안쿄로 옮겼다.",
    "significance": "천 년 가까이 교토가 정치·문화 중심지로 기능하는 출발점이 되었다.",
    "people": [
      "간무 천황"
    ],
    "relatedPlaces": [
      "교토고쇼",
      "헤이안 신궁"
    ],
    "keyPoints": [
      "헤이안 시대 시작",
      "귀족 문화 발달",
      "후대 일본 문화의 기반 형성"
    ],
    "wikiQuery": "헤이안쿄",
    "wikiQueryEn": "헤이안쿄"
  },
  {
    "id": "kamakura-1192",
    "title": "가마쿠라 막부 성립",
    "year": 1192,
    "place": "가마쿠라",
    "country": "일본",
    "region": "동아시아",
    "lat": 35.3192,
    "lon": 139.5467,
    "category": "politics",
    "summary": "미나모토노 요리토모가 쇼군으로 임명되어 무사 정권을 확립했다.",
    "significance": "일본에서 무사 계층이 정치권력의 중심이 되는 장기적 전환을 상징한다.",
    "people": [
      "미나모토노 요리토모"
    ],
    "relatedPlaces": [
      "쓰루가오카 하치만궁"
    ],
    "keyPoints": [
      "무사 정권의 제도화",
      "천황·귀족과 막부 권력의 병존",
      "봉건적 질서 발전"
    ],
    "wikiQuery": "가마쿠라 막부",
    "wikiQueryEn": "가마쿠라 막부"
  },
  {
    "id": "kyoto-1467",
    "title": "오닌의 난",
    "year": 1467,
    "place": "교토",
    "country": "일본",
    "region": "동아시아",
    "lat": 35.0116,
    "lon": 135.7681,
    "category": "war",
    "summary": "쇼군 후계 문제와 유력 다이묘 갈등이 교토에서 대규모 내전으로 번졌다.",
    "significance": "전국시대의 장기적 분열을 촉진하고 지방 세력의 독립성을 키웠다.",
    "people": [
      "호소카와 가쓰모토",
      "야마나 소젠"
    ],
    "relatedPlaces": [
      "교토"
    ],
    "keyPoints": [
      "교토 시가지 큰 피해",
      "막부 권위 약화",
      "전국시대의 배경이 됨"
    ],
    "wikiQuery": "오닌의 난",
    "wikiQueryEn": "오닌의 난"
  },
  {
    "id": "sekigahara-1600",
    "title": "세키가하라 전투",
    "year": 1600,
    "place": "세키가하라",
    "country": "일본",
    "region": "동아시아",
    "lat": 35.3653,
    "lon": 136.4675,
    "category": "war",
    "summary": "도쿠가와 이에야스의 동군이 서군을 격파했다.",
    "significance": "도쿠가와 막부 성립과 약 260년간의 에도 시대를 여는 결정적 전투였다.",
    "people": [
      "도쿠가와 이에야스",
      "이시다 미쓰나리"
    ],
    "relatedPlaces": [
      "세키가하라",
      "에도"
    ],
    "keyPoints": [
      "전국시대의 권력투쟁 종결",
      "도쿠가와 패권 확립",
      "에도 막부 성립으로 이어짐"
    ],
    "wikiQuery": "세키가하라 전투",
    "wikiQueryEn": "세키가하라 전투"
  },
  {
    "id": "tokyo-1868",
    "title": "메이지 유신과 에도 개칭",
    "year": 1868,
    "place": "도쿄",
    "country": "일본",
    "region": "동아시아",
    "lat": 35.6762,
    "lon": 139.6503,
    "category": "politics",
    "summary": "막부 체제가 무너지고 메이지 정부가 들어서며 에도는 도쿄로 불리게 되었다.",